{
  "id": "sy-damascus-university-medicine-program",
  "universityId": "sy-damascus-university",
  "facultyId": "sy-damascus-university-faculty-of-medicine",
  "name": {
    "en": "Medicine"
  },
  "aliases": [],
  "programType": "academic",
  "degreeLevel": "bachelor",
  "operationalStatus": "operating",
  "website": "https://damascusuniversity.edu.sy/",
  "sourceIds": ["approved-source-id"],
  "sourceReferences": [
    {
      "sourceId": "approved-source-id",
      "accessedAt": "2026-06-27T00:00:00.000Z"
    }
  ],
  "sourceStatus": "released"
}
